{
  "schema_version": 1,
  "contract_id": "sdk_expansion_r1_high_leverage.packet_009.v1",
  "subsystem": "sdk_expansion_r1_high_leverage",
  "kind": "interface",
  "status": "STATIC_DERIVED",
  "source_functions": ["0x004D82D0"],
  "signature": {
    "calling_convention": "thiscall",
    "return_type": "char",
    "parameters": [
      { "name": "this", "type": "_DWORD *" }
    ]
  },
  "layouts": [
    {
      "object": "this",
      "offset": "0x8",
      "width": 4,
      "evidence_refs": ["func:0x004D82D0", "packet:sdk_expansion_r1_high_leverage_009"]
    },
    {
      "object": "hud_emitter",
      "offset": "0x5C",
      "width": 4,
      "evidence_refs": ["func:0x004D82D0", "packet:sdk_expansion_r1_high_leverage_009"]
    },
    {
      "object": "hud_emitter",
      "offset": "0x60",
      "width": 4,
      "evidence_refs": ["func:0x004D82D0", "packet:sdk_expansion_r1_high_leverage_009"]
    }
  ],
  "globals": [
    { "address": "0x007CFEA0", "width": 4, "evidence_refs": ["global:0x007CFEA0", "func:0x004D82D0", "packet:sdk_expansion_r1_high_leverage_009"] },
    { "address": "0x005EA43C", "width": 4, "evidence_refs": ["global:0x005EA43C", "func:0x004D82D0", "packet:sdk_expansion_r1_high_leverage_009"] },
    { "address": "0x008AB6E4", "width": 4, "evidence_refs": ["global:0x008AB6E4", "func:0x004D82D0", "packet:sdk_expansion_r1_high_leverage_009"] },
    { "address": "0x007C56A8", "width": 4, "evidence_refs": ["global:0x007C56A8", "func:0x004D82D0", "packet:sdk_expansion_r1_high_leverage_009"] },
    { "address": "0x008AD394", "width": 4, "evidence_refs": ["global:0x008AD394", "func:0x004D82D0", "packet:sdk_expansion_r1_high_leverage_009"] },
    { "address": "0x008B8DC8", "width": 4, "evidence_refs": ["global:0x008B8DC8", "func:0x004D82D0", "packet:sdk_expansion_r1_high_leverage_009"] },
    { "address": "0x007CE234", "width": 4, "evidence_refs": ["global:0x007CE234", "func:0x004D82D0", "packet:sdk_expansion_r1_high_leverage_009"] }
  ],
  "preconditions": [
    "dword_7CFEA0 must be non-zero (input display mode active); otherwise the function returns immediately with its LOW byte.",
    "ConditionalFlagReturn(&dword_5EA43C) must be falsy.",
    "dword_8AB6E4 must not equal 2.",
    "this+0x8 (participant slot) must equal -1 (0xFFFFFFFF) for rendering to proceed."
  ],
  "postconditions": [
    "When at least one flag code was collected and dword_8AD394 is non-null, the null-terminated flag buffer is rendered via sub_553070(v9, 10, 0, dword_8B8DC8).",
    "The float fields at dword_8AD394+0x5C and +0x60 are temporarily overwritten with bit pattern 1069547520 and restored to their prior values afterwards.",
    "Return value carries the last flag-selection/state value in its LOW byte."
  ],
  "side_effects": [
    "Collects race-flag byte codes (62 yellow, 65 blue, 63 black, 102 pit, 66 checkered, plus 130/-126, 68, -116, -115 driver-condition codes) into a local stack buffer when dword_7CFEA0 == 2.",
    "Calls FieldSetterAt0x48(0xFFFFFF) when rendering.",
    "Temporarily writes bit pattern 1069547520 to two float fields at the object pointed to by dword_8AD394, then restores them.",
    "Renders the buffer through sub_553070; no persistent state is owned by this function across calls."
  ],
  "thread_requirement": "unknown",
  "lifecycle": [],
  "external_dependencies": [],
  "evidence_refs": [
    "packet:sdk_expansion_r1_high_leverage_009",
    "func:0x004D82D0",
    "global:0x007CFEA0",
    "global:0x005EA43C",
    "global:0x008AB6E4",
    "global:0x007C56A8",
    "global:0x008AD394",
    "global:0x008B8DC8"
  ],
  "candidate_refs": [],
  "disputes": [],
  "unresolved": [
    "External contract dependency (cut edge, replacement_owned, no target contract): func:0x00404F10 (ConditionalFlagReturn callee).",
    "External contract dependency (cut edge, replacement_owned, no target contract): func:0x0049B9A0 (driver-condition flag contributor).",
    "External contract dependency (cut edge, replacement_owned, no target contract): func:0x0049BA30 (selects flag codes -116/-115).",
    "External contract dependency (cut edge, replacement_owned, no target contract): func:0x0049BA50 (FuelWeightComputation callee).",
    "External contract dependency (cut edge, replacement_owned, no target contract): func:0x0049BA90 (PitStateFlagCheck callee).",
    "External contract dependency (cut edge, replacement_owned, no target contract): func:0x0049BAB0 (DisqualificationCheck callee).",
    "External contract dependency (cut edge, replacement_owned, no target contract): func:0x0049BAD0 (ShortComputation_bad0 yellow-flag callee).",
    "External contract dependency (cut edge, replacement_owned, no target contract): func:0x00552FC0 (FieldSetterAt0x48 callee).",
    "External contract dependency (cut edge, replacement_owned, no target contract): func:0x00553070 (flag render callee).",
    "global:0x007CE234 is reported by deterministic facts as referenced by this function but does not appear in the raw body text; its role is unresolved.",
    "The exact identities of dword_7CFEA0 (input display mode), dword_8AB6E4 (scoring gate) and dword_7C56A8 (race phase) are DERIVED from existing analysis, not from this packet alone.",
    "The constant 1069547520 overwrites two float fields at dword_8AD394 + 92/+96 as a raw bit pattern; no float interpretation is asserted.",
    "this+0x8 (participant slot) semantics as a driver slot index are DERIVED; the raw source only shows the != -1 comparison.",
    "Calling convention thiscall is asserted from the raw Hex-Rays signature (char __thiscall HUDFlagRendererMain(_DWORD *this)); no independent ABI review was performed.",
    "Thread requirement is unknown; HUD render paths typically run on the game thread but this packet contains no thread evidence."
  ],
  "tests_required": [
    "Verify that a non-zero dword_7CFEA0 with this+0x8 == -1 produces a flag buffer call into sub_553070 when a flag state is set.",
    "Verify flag byte codes (62/65/63/102/66 and driver-condition codes) match the render output for each guard condition.",
    "Verify the float fields at dword_8AD394+0x5C/+0x60 are restored to their original values after rendering."
  ],
  "dependencies": []
}
