{
  "schema_version": 1,
  "contract_id": "sdk_expansion_r1_closure_core.packet_006.v1",
  "subsystem": "sdk_expansion_r1_closure_core",
  "kind": "interface",
  "status": "STATIC_DERIVED",
  "source_functions": [
    "0x0042D8A0"
  ],
  "signature": {
    "calling_convention": "thiscall",
    "return_type": "int",
    "parameters": [
      {
        "name": "this",
        "type": "_DWORD*"
      }
    ]
  },
  "layouts": [
    {
      "object": "MainLoopState",
      "offset": "0x0",
      "width": 4,
      "evidence_refs": [
        "func:0x0042D8A0",
        "offset:MainLoopState+0x0",
        "packet:sdk_expansion_r1_closure_core_006"
      ]
    }
  ],
  "globals": [
    {
      "address": "0x007CD25C",
      "width": 4,
      "evidence_refs": [
        "global:0x007CD25C",
        "func:0x0042D8A0"
      ]
    },
    {
      "address": "0x007CE24D",
      "width": 4,
      "evidence_refs": [
        "global:0x007CE24D",
        "func:0x0042D8A0"
      ]
    },
    {
      "address": "0x007CE254",
      "width": 1,
      "evidence_refs": [
        "global:0x007CE254",
        "func:0x0042D8A0"
      ]
    },
    {
      "address": "0x008AB6E4",
      "width": 4,
      "evidence_refs": [
        "global:0x008AB6E4",
        "func:0x0042D8A0"
      ]
    },
    {
      "address": "0x007D2E50",
      "width": 4,
      "evidence_refs": [
        "global:0x007D2E50",
        "func:0x0042D8A0"
      ]
    },
    {
      "address": "0x005EA2C0",
      "width": 4,
      "evidence_refs": [
        "global:0x005EA2C0",
        "func:0x0042D8A0"
      ]
    },
    {
      "address": "0x008ACEE0",
      "width": 4,
      "evidence_refs": [
        "global:0x008ACEE0",
        "func:0x0042D8A0"
      ]
    },
    {
      "address": "0x007CA590",
      "width": 4,
      "evidence_refs": [
        "global:0x007CA590",
        "func:0x0042D8A0"
      ]
    },
    {
      "address": "0x005EC6D0",
      "width": 4,
      "evidence_refs": [
        "global:0x005EC6D0",
        "func:0x0042D8A0"
      ]
    },
    {
      "address": "0x0083EE60",
      "width": 4,
      "evidence_refs": [
        "global:0x0083EE60",
        "func:0x0042D8A0"
      ]
    },
    {
      "address": "0x008ACEA0",
      "width": 4,
      "evidence_refs": [
        "global:0x008ACEA0",
        "func:0x0042D8A0"
      ]
    },
    {
      "address": "0x005EA510",
      "width": 4,
      "evidence_refs": [
        "global:0x005EA510",
        "func:0x0042D8A0"
      ]
    },
    {
      "address": "0x008AB678",
      "width": 1,
      "evidence_refs": [
        "global:0x008AB678",
        "func:0x0042D8A0"
      ]
    },
    {
      "address": "0x007CE048",
      "width": 4,
      "evidence_refs": [
        "global:0x007CE048",
        "func:0x0042D8A0"
      ]
    },
    {
      "address": "0x008AC494",
      "width": 1,
      "evidence_refs": [
        "global:0x008AC494",
        "func:0x0042D8A0"
      ]
    },
    {
      "address": "0x008AFE18",
      "width": 4,
      "evidence_refs": [
        "global:0x008AFE18",
        "func:0x0042D8A0"
      ]
    },
    {
      "address": "0x008AFEC0",
      "width": 4,
      "evidence_refs": [
        "global:0x008AFEC0",
        "func:0x0042D8A0"
      ]
    },
    {
      "address": "0x007CE2A4",
      "width": 4,
      "evidence_refs": [
        "global:0x007CE2A4",
        "func:0x0042D8A0"
      ]
    },
    {
      "address": "0x008AD25C",
      "width": 4,
      "evidence_refs": [
        "global:0x008AD25C",
        "func:0x0042D8A0"
      ]
    },
    {
      "address": "0x005C3590",
      "width": 4,
      "evidence_refs": [
        "global:0x005C3590",
        "func:0x0042D8A0"
      ]
    },
    {
      "address": "0x005C3670",
      "width": 4,
      "evidence_refs": [
        "global:0x005C3670",
        "func:0x0042D8A0"
      ]
    }
  ],
  "preconditions": [
    "Called by GameMainEntry (0x0045B200, per graph context) as the main per-frame game loop; the session manager at 0x007CD25C and the conditional pipeline at 0x008AB6E4 must be initialized before the first iteration.",
    "The *this object must be a writable MainLoopState with room for an int at offset 0."
  ],
  "postconditions": [
    "On entry, the loop-phase counter at *this offset 0 is written to 5.",
    "Returns 0 when SessionStateCheck(0x007CD25C) == 1 is reached at the end of a loop body (session-state-driven clean exit), or when the restart gate returns 4.",
    "Returns 1 after the loop when the restart gate returns a value outside {4, 5, 6}; when the value is not 6 and StringSplitLoop(1, aDDevF119992002_11, 628) is non-zero, a debug line is written via DebugLogWrite(0x008AD25C, aNextStateDWasN)."
  ],
  "side_effects": [
    "Writes the loop-phase counter *this = 5 at function entry (offset 0 of MainLoopState).",
    "Per frame drives the conditional pipeline on 0x008AB6E4 (ConditionalMultiPathDispatcher, ConditionalStateUpdate, TwoPathDispatch) bracketed by ConditionalInit/ConditionalStateReset on 0x008AFE18.",
    "Per frame updates the session subsystem on 0x007CD25C (sub_463CA0, SessionScoringUpdate, CollisionResponseStatus) and resets buffers at 0x007D2E50 and 0x0083EE60.",
    "Per frame runs the multi-phase state machine on 0x005EA2C0, the module-output list at 0x008ACEE0, the collision broadcast through 0x007CA590, the main game tick on 0x005EC6D0 and vehicle iteration through 0x0083EE60.",
    "Per frame, when the byte_7CE254 flag is set, runs only WeatherParticleUpdate on 0x008ACEA0; otherwise runs the full camera/render/telemetry path (0x005EA510, 0x008ACEA0, 0x008AB678, 0x007CE048).",
    "Per frame advances the render tick state at 0x008AC494 and updates the auxiliary contexts at 0x008AFE18, 0x008AFEC0 and 0x007CE2A4 via sub_4FA7E0, sub_4FCEE0 and sub_4A1830.",
    "On an unexpected restart-gate exit may write a debug log through DebugLogWrite (0x008AD25C)."
  ],
  "thread_requirement": "game_thread",
  "lifecycle": [
    {
      "phase": "init",
      "owner": "GamePostMainLoop / MainLoopState (UnknownObject)",
      "evidence_refs": [
        "func:0x0042D8A0"
      ]
    },
    {
      "phase": "per-frame",
      "owner": "GamePostMainLoop / MainLoopState (UnknownObject)",
      "evidence_refs": [
        "func:0x0042D8A0"
      ]
    },
    {
      "phase": "exit",
      "owner": "GamePostMainLoop / MainLoopState (UnknownObject)",
      "evidence_refs": [
        "func:0x0042D8A0"
      ]
    }
  ],
  "external_dependencies": [],
  "evidence_refs": [
    "packet:sdk_expansion_r1_closure_core_006",
    "func:0x0042D8A0"
  ],
  "candidate_refs": [
    "sdk_expansion_r1_closure_core_006_candidate_1"
  ],
  "disputes": [
    {
      "field": "signature",
      "description": "thiscall with a _DWORD* this is taken directly from the raw Hex-Rays header; the identity of the *this object and the exact meaning of the 0/1 return values are DERIVED from control flow, not named by the packet."
    },
    {
      "field": "layouts[0]",
      "description": "The write *this = 5 at offset 0 is the only this-relative access in the function; the object boundary, field name and whether the same object is shared by other subsystems are not evidenced here."
    },
    {
      "field": "globals[].width",
      "description": "Widths follow the address-name convention (byte_ -> 1, dword_/pointer -> 4) and the IR; unk_ object globals (0x008AFE18, 0x007CE24D, 0x005EC6D0, 0x008AFEC0, 0x007CE2A4) have assumed width 4 with undefined internal layouts."
    }
  ],
  "unresolved": [
    "Owner object of *this is unknown; offset-0 field is a loop phase/state counter but its use by other subsystems is not visible in the packet.",
    "Restart-gate value meanings (5 = continue, 4/6 = exit paths) and byte_7CE254 (flag selecting the reduced per-frame path) are DERIVED from control flow, not named by the packet.",
    "Roles of the unnamed helpers sub_463CA0, sub_4D4580, sub_4FA7E0, sub_4FCEE0 and sub_4A1830 are inferred from their position in the loop only.",
    "Widths of the unk_ globals 0x008AFE18, 0x007CE24D, 0x005EC6D0, 0x008AFEC0 and 0x007CE2A4 are assumed 4; their internal layouts are undefined in the packet.",
    "Thread requirement game_thread is inferred from the main-per-frame-loop identity and the GameMainEntry caller; it is not directly evidenced in the packet.",
    "External contract dependencies (bounded-frontier cut edges with no target packet; behavior not bounded here): 0x00461CD0, 0x00463CA0, 0x00463CD0, 0x004643C0, 0x0049F070, 0x004A0FD0, 0x004A1830, 0x004B3B40, 0x004B3BA0, 0x004B40A0, 0x004BA150, 0x004BA180, 0x004BA6C0, 0x004C8B70, 0x004CFCC0, 0x004D4580, 0x004D7A50, 0x004D7AA0, 0x004F9F00, 0x004F9F30, 0x004FA7E0, 0x004FCEE0."
  ],
  "tests_required": [
    "Unit: verify MainLoopState offset 0 is written to 5 on function entry.",
    "Unit: verify the function returns 0 when SessionStateCheck(0x007CD25C) == 1 is observed at the end of a loop body.",
    "Unit: verify restart-gate exit returns 0 for gate value 4 and 1 for unexpected values, with the debug-log write gated by StringSplitLoop.",
    "Fixture: assert the per-frame subsystem update order matches the declared sequence (conditional pipeline, session, state machine, collision, tick, vehicles, camera/render/telemetry)."
  ],
  "dependencies": [
    "sdk_expansion_r1_closure_core.packet_000.v1",
    "sdk_expansion_r1_closure_core.packet_001.v1",
    "sdk_expansion_r1_closure_core.packet_005.v1",
    "sdk_expansion_r1_closure_core.packet_008.v1"
  ]
}
