{
  "schema_version": 1,
  "contract_id": "sdk_expansion_r1_closure_core.packet_002.v1",
  "subsystem": "sdk_expansion_r1_closure_core",
  "kind": "interface",
  "status": "STATIC_DERIVED",
  "source_functions": ["0x0042ACA0"],
  "signature": {
    "calling_convention": "thiscall",
    "return_type": "unsigned int",
    "parameters": [
      { "name": "this", "type": "_DWORD*" },
      { "name": "a2", "type": "unsigned int" }
    ]
  },
  "layouts": [
    {
      "object": "this",
      "offset": "0x4550",
      "width": 4,
      "evidence_refs": ["func:0x0042ACA0", "offset:this+0x4550", "packet:sdk_expansion_r1_closure_core_002"]
    }
  ],
  "globals": [],
  "preconditions": [
    "a2 is the requested AI speed-delta flag value; only 0 and 1 are accepted by this interface (guard a2 <= 1)."
  ],
  "postconditions": [
    "When a2 <= 1, the dword at this+0x4550 equals a2.",
    "When a2 == 1, sub_4A46F0(this, 1, 0) has been called and its return value is the function result.",
    "When a2 > 1, no state is written and a2 is returned unchanged."
  ],
  "side_effects": [
    "Writes a2 into the dword at this+0x4550 (the AI speed-delta flag) when a2 <= 1.",
    "Calls sub_4A46F0(this, 1, 0) when a2 == 1 to trigger an AI state transition on the same receiver."
  ],
  "thread_requirement": "unknown",
  "lifecycle": [
    {
      "phase": "runtime_update",
      "owner": "UnknownObject (this-receiver; owner unresolved)",
      "evidence_refs": ["func:0x0042ACA0", "packet:sdk_expansion_r1_closure_core_002"]
    }
  ],
  "external_dependencies": [],
  "evidence_refs": ["packet:sdk_expansion_r1_closure_core_002", "func:0x0042ACA0"],
  "candidate_refs": [],
  "disputes": [],
  "unresolved": [
    "External contract dependency 0x004A46F0 is cut at the packet frontier; its behavior and the meaning of the state-transition arguments (1, 0) are only caller-visible and are not evidenced here.",
    "The `this` receiver type and owner are unresolved; caller evidence (0x00429EE0, 0x004EF5A0) is present only as graph_context, not as an ownership claim (shared-caller rule).",
    "The field at this+0x4550 is read as an AI speed-delta flag from the proposed name and architecture excerpt; its semantic role is DERIVED, not independently confirmed.",
    "Global 0x007CE2F0 appears in the deterministic global set for this function's IR but is not visible in the raw source; its role is unknown."
  ],
  "tests_required": [
    "Call with a2=0 and a2=1: verify dword at this+0x4550 becomes the value.",
    "Call with a2>1: verify dword at this+0x4550 is unchanged and return equals a2.",
    "Call with a2==1: verify sub_4A46F0(this, 1, 0) is invoked once and its result is returned."
  ],
  "dependencies": []
}
